<?xml version="1.0" encoding="ISO-8859-1" ?>
<!DOCTYPE package SYSTEM "package.dtd">
<package version="1.0">
  <name>DB</name>
  <summary>Database Abstraction Layer</summary>
  <description>
DB is a database abstraction layer providing:
 * an OO-style query API
 * a DSN (data source name) format for specifying database servers
 * prepare/execute (bind) emulation for databases that don't support
   it natively
 * a result object for each query response
 * portable error codes
 * sequence emulation
 * table information interface

DB layers itself on top of PHP's existing database extensions.  The
currently supported extensions are: dbase, fbsql, interbase, informix,
msql, mssql, mysql, oci8, odbc, pgsql and sybase.
</description>
  <license>PHP License</license>
  <maintainers>
    <maintainer>
      <user>ssb</user>
      <role>lead</role>
      <name>Stig Sæther Bakken</name>
      <email>stig@php.net</email>
    </maintainer>
    <maintainer>
      <user>cox</user>
      <role>developer</role>
      <name>Tomas V.V.Cox</name>
      <email>cox@idecnet.com</email>
    </maintainer>
  </maintainers>
  <release>
    <version>1.0</version>
    <state>stable</state>
    <date>2002-04-07</date>
    <notes>First packaged release.</notes>
    <filelist>
      <file role="php" baseinstalldir="/">DB.php</file>
      <dir name="DB">
	<file role="php">common.php</file>
	<file role="php">dbase.php</file>
	<file role="php">fbsql.php</file>
	<file role="php">ibase.php</file>
	<file role="php">ifx.php</file>
	<file role="php">msql.php</file>
	<file role="php">mssql.php</file>
	<file role="php">mysql.php</file>
	<file role="php">oci8.php</file>
	<file role="php">odbc.php</file>
	<file role="php">pgsql.php</file>
	<file role="php">sybase.php</file>
	<file role="php">storage.php</file>
	<file role="data">IDEAS</file>
	<file role="data">MAINTAINERS</file>
	<file role="data">STATUS</file>
	<file role="data">TESTERS</file>
	<dir name="tests">
	  <file role="test">db_error.phpt</file>
	  <file role="test">db_parsedsn.phpt</file>
	  <file role="test">db_factory.phpt</file>
	  <file role="test">db_ismanip.phpt</file>
	  <file role="test">db_error2.phpt</file>
	  <dir name="oci8">
	    <file role="test">06prepexec.phpt</file>
	    <file role="test">08affectedrows.phpt</file>
	    <file role="test">09numrows.phpt</file>
	    <file role="test">13limit.phpt</file>
	    <file role="test">05sequences.phpt</file>
	    <file role="test">07errornative.phpt</file>
	    <file role="test">01connect.phpt</file>
	    <file role="test">10errormap.phpt</file>
	    <file role="test">04numcols.phpt</file>
	    <file role="test">03simplequery.phpt</file>
	    <file role="test">02fetch.phpt</file>
	  </dir>
	  <dir name="odbc">
	    <file role="test">06prepexec.phpt</file>
	    <file role="test">09numrows.phpt</file>
	    <file role="test">07errornative.phpt</file>
	    <file role="test">01connect.phpt</file>
	    <file role="test">10errormap.phpt</file>
	    <file role="test">04numcols.phpt</file>
	    <file role="test">03simplequery.phpt</file>
	    <file role="test">02fetch.phpt</file>
	  </dir>
	  <dir name="ibase">
	    <file role="test">06prepexec.phpt</file>
	    <file role="test">05sequences.phpt</file>
	    <file role="test">01connect.phpt</file>
	    <file role="test">10errormap.phpt</file>
	    <file role="test">04numcols.phpt</file>
	    <file role="test">03simplequery.phpt</file>
	    <file role="test">02fetch.phpt</file>
	  </dir>
	  <dir name="mysql">
	    <file role="test">06prepexec.phpt</file>
	    <file role="test">08affectedrows.phpt</file>
	    <file role="test">09numrows.phpt</file>
	    <file role="test">13limit.phpt</file>
	    <file role="test">05sequences.phpt</file>
	    <file role="test">07errornative.phpt</file>
	    <file role="test">12tableinfo.phpt</file>
	    <file role="test">01connect.phpt</file>
	    <file role="test">10errormap.phpt</file>
	    <file role="test">04numcols.phpt</file>
	    <file role="test">03simplequery.phpt</file>
	    <file role="test">14fetchmode_object.phpt</file>
	    <file role="test">02fetch.phpt</file>
	  </dir>
	  <dir name="pgsql">
	    <file role="test">06prepexec.phpt</file>
	    <file role="test">11transact.phpt</file>
	    <file role="test">08affectedrows.phpt</file>
	    <file role="test">09numrows.phpt</file>
	    <file role="test">13limit.phpt</file>
	    <file role="test">05sequences.phpt</file>
	    <file role="test">07errornative.phpt</file>
	    <file role="test">01connect.phpt</file>
	    <file role="test">10errormap.phpt</file>
	    <file role="test">04numcols.phpt</file>
	    <file role="test">03simplequery.phpt</file>
	    <file role="test">14fetchmode_object.phpt</file>
	    <file role="test">02fetch.phpt</file>
	  </dir>
	  <dir name="driver">
	    <file role="test">06prepexec.phpt</file>
	    <file role="test">08affectedrows.phpt</file>
	    <file role="test">09numrows.phpt</file>
	    <file role="test">13limit.phpt</file>
	    <file role="test">05sequences.phpt</file>
	    <file role="test">15quote.phpt</file>
	    <file role="test">01connect.phpt</file>
	    <file role="test">10errormap.phpt</file>
	    <file role="test">04numcols.phpt</file>
	    <file role="test">03simplequery.phpt</file>
	    <file role="test">14fetchmode_object.phpt</file>
	    <file role="test">02fetch.phpt</file>
	  </dir>
	</dir>
      </dir>
    </filelist>
  </release>
</package>
